{"$schema":"https://json-schema.org/draft/2020-12/schema","$id":"https://pyrallon.local/contracts/effect-context/v2","type":"object","required":["tenant_id","actor_id","journey_id","capability_id","capability_version","connector_binding_id","inventory_version","preview_digest","constraint_digest","channel","policy_version","idempotency_key","expires_at"],"properties":{"tenant_id":{"type":"string"},"actor_id":{"type":"string"},"journey_id":{"type":"string"},"capability_id":{"type":"string","pattern":"^[a-z0-9_-]+:[a-z0-9_.-]+$"},"capability_version":{"type":"string"},"connector_binding_id":{"type":"string"},"inventory_version":{"type":"string"},"preview_digest":{"pattern":"^[a-f0-9]{64}$","type":"string"},"constraint_digest":{"pattern":"^[a-f0-9]{64}$","type":"string"},"channel":{"enum":["email","sms","voice","calendar","webhook","crm"]},"policy_version":{"type":"string"},"idempotency_key":{"type":"string"},"expires_at":{"type":"string","format":"date-time"}},"additionalProperties":false}

