{"tenant_id":"t1","actor_id":"a1","journey_id":"j1","capability_id":"google:gmail.send","capability_version":"1","connector_binding_id":"b1","inventory_version":"i1","preview_digest":"0123456789abcdef0123456789abcdef0123456789abcdef0123456789abcdef","constraint_digest":"abcdef0123456789abcdef0123456789abcdef0123456789abcdef0123456789","channel":"email","policy_version":"p1","idempotency_key":"k1","expires_at":"2026-08-20T12:00:00Z"}

